{
  "schema_version": 1,
  "left_roots": {"fixtures": "../build/fixtures"},
  "right_roots": {"fixtures": "../build/fixtures"},
  "objects": {
    "consumer": {"root": "fixtures", "path": "consumer.so"},
    "a": {"root": "fixtures", "path": "a/libsame.so"},
    "b": {"root": "fixtures", "path": "b/libsame.so"}
  },
  "selectors": [
    {"reference": "consumer", "symbol": "shared_value", "trace_version": "", "providers": ["a", "b"], "required": true}
  ]
}
