{
  "schema_version": 1,
  "left_roots": {
    "system": "/",
    "built": "/work/build/validation/bookworm/zlib-builds/one"
  },
  "right_roots": {
    "system": "/",
    "built": "/work/build/validation/bookworm/zlib-builds/two"
  },
  "objects": {
    "python-zlib": {
      "root": "system",
      "path": "opt/cpython/lib/python3.11/lib-dynload/zlib.cpython-311-aarch64-linux-gnu.so"
    },
    "python": {
      "root": "system",
      "path": "opt/cpython/bin/python3.11"
    },
    "built-zlib": {
      "root": "built",
      "path": "lib/libz.so.1.3.1"
    }
  },
  "selectors": [
    {
      "reference": "python-zlib",
      "symbol": "deflate",
      "providers": [
        "built-zlib"
      ],
      "required": true
    },
    {
      "reference": "python-zlib",
      "symbol": "inflate",
      "providers": [
        "built-zlib"
      ],
      "required": true
    }
  ]
}
